{
  "$schema": "http://json-schema.org/draft-07/schema#",
  "$id": "https://example.org/schemas/agent/instance.stopped.schema.json",
  "title": "Agent Instance Stopped Payload",
  "type": "object",
  "additionalProperties": false,
  "required": [
    "poolId",
    "instanceId"
  ],
  "properties": {
    "poolId": {
      "type": "string",
      "minLength": 1,
      "description": "Stable identifier of the pool or runner group."
    },
    "poolName": {
      "type": [
        "string",
        "null"
      ],
      "description": "Display name of the pool or runner group."
    },
    "instanceId": {
      "type": "string",
      "minLength": 1,
      "description": "Stable identifier of the stopped agent or runner instance."
    },
    "instanceName": {
      "type": [
        "string",
        "null"
      ],
      "description": "Display name or hostname for the instance before deprovision."
    },
    "stopReason": {
      "type": [
        "string",
        "null"
      ],
      "enum": [
        "scale-in",
        "replacement",
        "maintenance",
        "manual",
        "failure",
        "unknown",
        null
      ],
      "description": "Optional normalized reason the instance was deprovisioned."
    },
    "details": {
      "type": "object",
      "additionalProperties": true,
      "description": "Provider-specific metadata for this lifecycle event, such as final health status or drain telemetry."
    }
  }
}