{
  "poolId": "prod-linux",
  "poolName": "Production Linux Agent Pool",
  "instanceId": "agent-vm-001",
  "instanceName": "agent-vm-001.contoso.com",
  "stopReason": "scale-in",
  "details": {
    "scaleInTriggerId": "scale-20260421-00123",
    "vmId": "12345678-1234-1234-1234-123456789012",
    "deprovisionTime": "2026-04-21T14:15:30Z",
    "totalUptime": 86400
  }
}
